{
  "draft_id": "draft_example_1",
  "opportunity": {
    "opportunity_id": "example_club_event",
    "kind": "event",
    "title": "Example Data Workshop",
    "organizer_id": "example_club",
    "source_url": "https://www.instagram.com/p/example_post/",
    "source_post_id": "example_post",
    "source_post_ids": ["example_post"],
    "description": "Synthetic fixture event.",
    "activity_type_ids": ["workshop"],
    "topic_ids": ["data_ai"],
    "skill_ids": ["python"],
    "beginner_level": "unknown",
    "eligibility_note": null,
    "format": "unknown",
    "location": null,
    "start_at": null,
    "end_at": null,
    "deadline_at": null,
    "timezone": "America/Toronto",
    "date_precision": "unknown",
    "start_date": null,
    "end_date": null,
    "deadline_date": null,
    "start_precision": "unknown",
    "end_precision": "unknown",
    "deadline_precision": "unknown",
    "start_date_text": null,
    "end_date_text": null,
    "deadline_date_text": null,
    "verified_at": "2026-10-26T12:00:00Z",
    "review_status": "needs_review",
    "classification_reasons": [],
    "registration_url": null,
    "source_updated_at": null,
    "content_revision": 1,
    "change_pending": false
  },
  "evidence": [
    {
      "field": "activity_type_ids",
      "candidate_value": ["workshop"],
      "evidence_text": "Data workshop",
      "source_part": "image_ocr",
      "media_position": 1,
      "rule_id": "activity.workshop.keyword"
    }
  ],
  "missing_fields": ["start_date", "registration_url"],
  "conflicts": [],
  "exclusion_reason": null,
  "created_at": "2026-10-26T12:06:00Z"
}
